{
  "schema_version": "sanctuary.incubation/v1",
  "id": "example-capability",
  "title": "Example capability",
  "summary": "Demonstrates the minimum valid Sanctuary incubation record.",
  "state": "intake",
  "question": "Can this capability prove a distinct, reusable boundary?",
  "owner": "szmyty",
  "reviewers": ["szmyty"],
  "data_classification": "public",
  "sources": [
    {
      "kind": "original",
      "url": null,
      "revision": null,
      "license": "MIT",
      "attribution": "Original Ego Hygiene experiment.",
      "recorded_at": "2026-08-21"
    }
  ],
  "candidate_destinations": ["egohygiene/sanctuary"],
  "exit_criteria": [
    "The experiment answers its recorded question with reviewable evidence.",
    "A durable existing owner is preferred or a separate repository decision is approved."
  ],
  "baseline_exceptions": [],
  "decision": {
    "status": "pending",
    "issue": null,
    "destination": null,
    "decided_at": null,
    "rationale": null
  },
  "created_at": "2026-08-21",
  "updated_at": "2026-08-21"
}
